,title,score,id,subreddit,url,num_comments,body,created
0,"Daily Thread - March 11, 2023",9,11oecxm,teslainvestorsclub,https://www.reddit.com/r/teslainvestorsclub/comments/11oecxm/daily_thread_march_11_2023/,49,"All topics are permitted in this thread. If you are new here (or even if you're not), please skim through our [Rules and Disclaimer](https://www.reddit.com/r/teslainvestorsclub/wiki/index) page to gain a better understanding of expectations in our community.

See our [Long-running Thread](https://www.reddit.com/r/teslainvestorsclub/search?q=flair_name%3A%22📜%22&restrict_sr=1) for more in-depth discussions.

https://preview.redd.it/lhv8txqvuu191.png?width=250&format=png&auto=webp&v=enabled&s=267eb357a6754fd918a6c316004c470715caefc5",1678521652.0
1,Call For Moderators,20,11mljej,teslainvestorsclub,https://www.reddit.com/r/teslainvestorsclub/comments/11mljej/call_for_moderators/,27,"Hello all,

The subreddit has been running thin on moderators for the last while, and we've finally reached a point where it can't continue to function without new mods assisting. This post is a request for anyone interested in modding here to explain in a couple sentences who you are, why you'd like to mod here, and your approach to the position. 

This is a serious thread, as it directly relates to the running of the subreddit and some vital roles. Off-topic or unhelpful comments will result in a temp-ban; you've been warned.

Cheers!  
~Corinth",1678345365.0
2,"Elon Musk says he's 'open to the idea' of buying Silicon Valley Bank, but a Tesla investor tells him 'no thanks'",88,11oi9m9,teslainvestorsclub,https://www.businessinsider.com/elon-musk-buy-silicon-valley-bank-tesla-investor-no-thanks-2023-3?utm_source=reddit&utm_medium=social&utm_campaign=insider-economy-sub-post,61,,1678535478.0
3,China car market price war,22,11on2yy,teslainvestorsclub,https://twitter.com/yilunzh/status/1634356311960739841,18,,1678548949.0
4,Sec a from 4 Elon Musk,20,11o6nq1,teslainvestorsclub,https://www.sec.gov/Archives/edgar/data/1318605/000089924323008179/xslF345X03/doc4.xml,24,,1678496898.0
5,Are these new midnight cherry red production teslas?,62,11nsceb,teslainvestorsclub,https://i.imgur.com/qN6DDaz.jpg,9,Credit to Tobias Lindh Gigaberlin flyover,1678462620.0
6,Palo Alto rolls out dial-a-Tesla fleet.,63,11n9e3d,teslainvestorsclub,https://paloaltoonline.com/news/2023/03/08/now-roaming-palo-alto-streets-on-demand-teslas,5,,1678408775.0
7,"Daily Thread - March 10, 2023",15,11niugt,teslainvestorsclub,https://www.reddit.com/r/teslainvestorsclub/comments/11niugt/daily_thread_march_10_2023/,75,"All topics are permitted in this thread. If you are new here (or even if you're not), please skim through our [Rules and Disclaimer](https://www.reddit.com/r/teslainvestorsclub/wiki/index) page to gain a better understanding of expectations in our community.

See our [Long-running Thread](https://www.reddit.com/r/teslainvestorsclub/search?q=flair_name%3A%22📜%22&restrict_sr=1) for more in-depth discussions.

https://preview.redd.it/lhv8txqvuu191.png?width=250&format=png&auto=webp&v=enabled&s=267eb357a6754fd918a6c316004c470715caefc5",1678435268.0
8,in case people really think the cybertruck will just look like a chunk of steel,43,11naij9,teslainvestorsclub,https://www.youtube.com/watch?v=cAx0bHKhhnw,45,,1678411618.0
9,"What Happens in Your Tesla, Stays in Your Tesla",83,11n3jgj,teslainvestorsclub,https://www.youtube.com/watch?v=hrHGK9AdWHQ,19,,1678395414.0
10,GM offers buyouts to ‘majority’ of U.S. salaried workers,99,11my3c0,teslainvestorsclub,https://www.cnbc.com/2023/03/09/gm-buyouts-us-salaried-workers.html,75,,1678382860.0
11,Adam Jones Morgan Stanley: Has Tesla Outgrown the Cybertruck?,34,11mv4g1,teslainvestorsclub,https://i.redd.it/89e873rifqma1.png,115,,1678375834.0
12,"Tesla launches new ultra red color for the Model S and Model x in US for 3,000",72,11mosvm,teslainvestorsclub,https://ev-edition.com/2023/03/tesla-launches-new-ultra-red-color-for-the-model-s-and-model-x-in-us-for-3000/,34,,1678357586.0
13,"Telsa has launched a new Ultra Red color for the Model S and Model X in the US for $3,000.",62,11mo9pi,teslainvestorsclub,https://twitter.com/SawyerMerritt/status/1633722749418889216,18,,1678355606.0
14,"Daily Thread - March 09, 2023",21,11mmisb,teslainvestorsclub,https://www.reddit.com/r/teslainvestorsclub/comments/11mmisb/daily_thread_march_09_2023/,205,"All topics are permitted in this thread. If you are new here (or even if you're not), please skim through our [Rules and Disclaimer](https://www.reddit.com/r/teslainvestorsclub/wiki/index) page to gain a better understanding of expectations in our community.

See our [Long-running Thread](https://www.reddit.com/r/teslainvestorsclub/search?q=flair_name%3A%22📜%22&restrict_sr=1) for more in-depth discussions.

https://preview.redd.it/lhv8txqvuu191.png?width=250&format=png&auto=webp&v=enabled&s=267eb357a6754fd918a6c316004c470715caefc5",1678348849.0
15,Ark Invests : Tesla Is Reducing EV Costs By 50% Over The Next 5 Years,157,11lz2wz,teslainvestorsclub,https://ev-edition.com/2023/03/ark-invests-tesla-is-reducing-ev-costs-by-50-over-the-next-5-years/,53,,1678288960.0
16,Could Tesla's New EV Charging Network Boost Their Revenue by Billions?,59,11m61ot,teslainvestorsclub,https://www.reddit.com/r/teslainvestorsclub/comments/11m61ot/could_teslas_new_ev_charging_network_boost_their/,33,"&#x200B;

[Goldman predictions on Tesla opening charging access](https://preview.redd.it/de9rhgtbfkma1.jpg?width=1200&format=pjpg&auto=webp&v=enabled&s=44fe69f69c041e5885755b1194cb958496b583dc)

The analysis by Goldman Sachs showed that Tesla's revenue could increase by billions of dollars. This is because Tesla's charging network is already the most extensive and reliable in the world, and opening it up to other EVs will make it an even more attractive option for EV drivers. It's worth noting that the Goldman Sachs analysis only used a quantity of chargers that was below the current number of Tesla chargers. This means that the revenue potential could be even higher than estimated, as Tesla continues to expand its charging network.

By opening up its charging network to all EVs, Tesla is not only creating a new revenue stream but directly interacting with their competitor’s customers, as they have to download the Tesla App and pay a membership fee. This could encourage non-Tesla EV owners to switch to a Tesla vehicle, which could further increase Tesla's market share in the EV industry. 

One of the biggest selling points of Tesla's charging network is the fact that it is about 25% cheaper per session than other EV charging networks. While the idea of paying a $12.99 monthly fee may seem costly at first, this price point is still feasible for the entire EV market. This could make Tesla's charging network the go-to charging solution for all EV drivers, not just Tesla owners.

Moreover, with the rollout of this technology, Tesla can tap into billions in federal subsidies, further increasing their revenue potential. 

 Article Mentioned: [Why Elon Musk Opened The EV Charging Network](https://carbontrading.substack.com/p/why-elon-musk-opened-the-ev-charging/?e3w0)

What do you all think about this news? Do you agree that opening up the charging network will have a significant impact on Tesla's revenue?",1678304789.0
17,FSDBeta 11.3.1 - Single Stack First Drive - Orlando FL (Chuck Cook),53,11lzdgt,teslainvestorsclub,https://www.youtube.com/watch?v=iJbJS-UQIDc,10,,1678289666.0
18,Tesla Analyst Says 'Weaponized' Capacity Is Already Priced In: Is Elon Musk Playing Chess While Other Automakers Play Catch Up?,15,11m3528,teslainvestorsclub,https://www.benzinga.com/analyst-ratings/analyst-color/23/03/31258628/tesla-analyst-says-weaponized-capacity-is-already-priced-in-is-elon-musk-playing-ch,0,,1678298253.0
19,Thoughts on why Model S/X inventory levels spiked AFTER price cuts?? (This is opposite of what we saw for Model 3/Y after their price cuts),28,11lwxhi,teslainvestorsclub,https://i.redd.it/xi1i8zxnsima1.png,36,,1678283493.0
20,"I haven't looked at this in a while, looks like $TSLA shorts are down around $56.5 billion since 2010.",109,11lcx4t,teslainvestorsclub,https://twitter.com/ihors3/status/1632857249839284225?s=20,38,,1678226629.0
21,"Daily Thread - March 08, 2023",17,11lqb1y,teslainvestorsclub,https://www.reddit.com/r/teslainvestorsclub/comments/11lqb1y/daily_thread_march_08_2023/,254,"All topics are permitted in this thread. If you are new here (or even if you're not), please skim through our [Rules and Disclaimer](https://www.reddit.com/r/teslainvestorsclub/wiki/index) page to gain a better understanding of expectations in our community.

See our [Long-running Thread](https://www.reddit.com/r/teslainvestorsclub/search?q=flair_name%3A%22📜%22&restrict_sr=1) for more in-depth discussions.

https://preview.redd.it/lhv8txqvuu191.png?width=250&format=png&auto=webp&v=enabled&s=267eb357a6754fd918a6c316004c470715caefc5",1678262461.0
22,"Troy Teslike on Twitter, Tesla Q1 delivery estimates were as follows on 28 Feb:",12,11lelm6,teslainvestorsclub,https://twitter.com/troyteslike/status/1633164073314447380?s=21&t=-Bm1eUg-z-tRoKBTbwejcA,56,,1678230295.0
23,MKBHD reviews Kia EV6 GT. At $65k and 200 mile range Tesla *still* has no real competition.,145,11knojv,teslainvestorsclub,https://www.youtube.com/watch?v=gDD0H4aE5u0,92,,1678159490.0
24,Week 57 update for #FSDBeta Community Tracker,23,11kx8x8,teslainvestorsclub,https://i.redd.it/di9d1rzi2bma1.png,3,,1678189876.0
25,Tesla stock slips as analysts downgrade to Buy on limited upside By Investing.com,0,11lufsn,teslainvestorsclub,https://www.investing.com/news/stock-market-news/tesla-stock-slips-as-analysts-downgrade-to-buy-on-limited-upside-432SI-3024811,8,,1678276484.0
26,Elon Musk Documentary Coming From Oscar Winner Alex Gibney,76,11kkgmd,teslainvestorsclub,https://variety.com/2023/film/news/elon-musk-documentary-alex-gibney-scientology-oscars-1235544410/,35,,1678151335.0
27,"Daily Thread - March 07, 2023",16,11kt4sj,teslainvestorsclub,https://www.reddit.com/r/teslainvestorsclub/comments/11kt4sj/daily_thread_march_07_2023/,266,"All topics are permitted in this thread. If you are new here (or even if you're not), please skim through our [Rules and Disclaimer](https://www.reddit.com/r/teslainvestorsclub/wiki/index) page to gain a better understanding of expectations in our community.

See our [Long-running Thread](https://www.reddit.com/r/teslainvestorsclub/search?q=flair_name%3A%22📜%22&restrict_sr=1) for more in-depth discussions.

https://preview.redd.it/lhv8txqvuu191.png?width=250&format=png&auto=webp&v=enabled&s=267eb357a6754fd918a6c316004c470715caefc5",1678176047.0
28,"New data shows 1 in 7 cars sold globally is an EV, and combustion engine car sales have decreased by 25% since 2017",134,11jyxkn,teslainvestorsclub,https://www.iea.org/fuels-and-technologies/electric-vehicles,20,,1678109232.0
29,Tesla is leading a price war,143,11jxfxm,teslainvestorsclub,https://news.yahoo.com/byd-18-billion-rout-shows-041446545.html,45,,1678105412.0
30,"Autoline Youtube - Move Over Mr. Ford, Tesla Just Reinvented The Assembly Line",68,11k2l4q,teslainvestorsclub,https://www.youtube.com/watch?v=3f0Hx-Ncdu8,24,,1678118148.0
31,"EXCLUSIVE: Experiencing ""Tesla speed"" at Shanghai gigafactory",30,11jx1wk,teslainvestorsclub,https://www.youtube.com/live/KmGaAcWbRMk?feature=share,10,,1678104343.0
32,Tesla Celebrates 4 Millionth Vehicle Produced,116,11jj7fu,teslainvestorsclub,https://insideevs.com/news/655631/tesla-4000000th-vehicle-produced/,11,,1678063130.0
33,Model S and X price reduction in USA,44,11jq2jy,teslainvestorsclub,https://twitter.com/SawyerMerritt/status/1632577507932119040?t=ONl3VM-8-6NBwyqqF4Suhw&s=19,22,,1678082061.0
34,Tesla Stock Is More Popular Than Ever Among Individual Investors,100,11jijk9,teslainvestorsclub,https://www.wsj.com/articles/tesla-stock-popular-investors-ever-deb85a4,30,,1678061434.0
35,"Daily Thread - March 06, 2023",17,11jshuj,teslainvestorsclub,https://www.reddit.com/r/teslainvestorsclub/comments/11jshuj/daily_thread_march_06_2023/,58,"All topics are permitted in this thread. If you are new here (or even if you're not), please skim through our [Rules and Disclaimer](https://www.reddit.com/r/teslainvestorsclub/wiki/index) page to gain a better understanding of expectations in our community.

See our [Long-running Thread](https://www.reddit.com/r/teslainvestorsclub/search?q=flair_name%3A%22📜%22&restrict_sr=1) for more in-depth discussions.

https://preview.redd.it/lhv8txqvuu191.png?width=250&format=png&auto=webp&v=enabled&s=267eb357a6754fd918a6c316004c470715caefc5",1678089682.0
36,Think Tesla Is Losing Popularity? Think Again,43,11jiavt,teslainvestorsclub,https://www.fool.com/investing/2023/03/04/think-tesla-is-losing-popularity-think-again/,7,,1678060845.0
37,ANALYSIS-Foxconn races to become an EV player and the clock is ticking,14,11jnq5h,teslainvestorsclub,https://www.nasdaq.com/articles/analysis-foxconn-races-to-become-an-ev-player-and-the-clock-is-ticking,5,,1678075237.0
38,Tesla has reduced the price of unsold cars in Europe by 6%,71,11j5ijr,teslainvestorsclub,https://twitter.com/TroyTeslike/status/1631897843454685185?t=L_upcmT-gWMi58s52MZXyA&s=19,69,,1678039379.0
39,Tesla is no longer a Top Pick auto stock at Morgan Stanley; replaced by Ferrari By Investing.com,0,11jz760,teslainvestorsclub,https://www.investing.com/news/stock-market-news/tesla-is-no-longer-a-top-pick-auto-stock-at-morgan-stanley-replaced-by-ferrari-432SI-3022840,12,,1678109911.0
40,The experts get it,86,11ij6cu,teslainvestorsclub,https://youtu.be/3f0Hx-Ncdu8,23,,1677978540.0
41,"Tesla Did Introduce The Model 2 This Week At $26,000, But Kept It Quiet",77,11ijcl1,teslainvestorsclub,https://www.forbes.com/sites/bradtempleton/2023/03/03/tesla-did-introduce-the-model-2-this-week-at-26000-but-kept-it-quiet/?sh=73a0f6ae1fdd,39,,1677979013.0
42,"Daily Thread - March 05, 2023",11,11irdjd,teslainvestorsclub,https://www.reddit.com/r/teslainvestorsclub/comments/11irdjd/daily_thread_march_05_2023/,40,"All topics are permitted in this thread. If you are new here (or even if you're not), please skim through our [Rules and Disclaimer](https://www.reddit.com/r/teslainvestorsclub/wiki/index) page to gain a better understanding of expectations in our community.

See our [Long-running Thread](https://www.reddit.com/r/teslainvestorsclub/search?q=flair_name%3A%22📜%22&restrict_sr=1) for more in-depth discussions.

https://preview.redd.it/lhv8txqvuu191.png?width=250&format=png&auto=webp&v=enabled&s=267eb357a6754fd918a6c316004c470715caefc5",1678003254.0
43,Ford is creating a new division to lead its partial autonomy and hands-free driving tech,56,11hyp5n,teslainvestorsclub,https://www.theverge.com/2023/3/2/23622058/ford-latitude-ai-level-3-hands-free-driving-automated-argo,21,,1677935098.0
44,"Sawyer Merritt - NEWS: @Tesla retail investors have spent a net $13.6 billion on $TSLA shares so far in 2023, approaching the record sum of nearly $17 billion for all of last year, according to Vanda Research. “The aggregate retail inflows into $TSLA have never been higher”",141,11hce46,teslainvestorsclub,https://twitter.com/SawyerMerritt/status/1631737116857073665?s=20,54,,1677871803.0
45,"Daily Thread - March 04, 2023",12,11htl7i,teslainvestorsclub,https://www.reddit.com/r/teslainvestorsclub/comments/11htl7i/daily_thread_march_04_2023/,30,"All topics are permitted in this thread. If you are new here (or even if you're not), please skim through our [Rules and Disclaimer](https://www.reddit.com/r/teslainvestorsclub/wiki/index) page to gain a better understanding of expectations in our community.

See our [Long-running Thread](https://www.reddit.com/r/teslainvestorsclub/search?q=flair_name%3A%22📜%22&restrict_sr=1) for more in-depth discussions.

https://preview.redd.it/lhv8txqvuu191.png?width=250&format=png&auto=webp&v=enabled&s=267eb357a6754fd918a6c316004c470715caefc5",1677916851.0
46,Mississippi passes bill restricting electric car dealerships,108,11h4cnt,teslainvestorsclub,https://apnews.com/article/mississippi-electric-cars-sales-tesla-31c06e7ecb9693f15bc578623b56fd9c,76,,1677859471.0
47,"Tesla Shanghai sold 74,402 EVs in February, up 31% year on year",201,11gzghf,teslainvestorsclub,https://carnewschina.com/2023/03/03/tesla-shanghai-sold-74402-evs-in-february-up-31-year-on-year/,56,,1677846327.0
48,Interview from Matthew Donegan-Ryan with Tom Zhu,56,11h8pxb,teslainvestorsclub,https://twitter.com/MatthewDR/status/1631708001487962112,37,,1677866065.0
49,Possible first V4 SuperCharger under construction in The Netherlands.,29,11hbwhb,teslainvestorsclub,https://youtu.be/L8yjEb8ajnc,6,,1677870670.0
50,Visualized | 40 Years of U.S. Automobile Recalls 🚗,17,11hdjaa,teslainvestorsclub,https://www.visualcapitalist.com/cp/visualized-40-years-of-u-s-automobile-recalls/?utm_source=Visual+Capitalist+Infographics+%28All%29&utm_campaign=3a8916b796-EMAIL_CAMPAIGN_2023_03_02&utm_medium=email&utm_term=0_31b4d09e8a-3a8916b796-44828970,3,,1677874446.0
51,"Tesla Models To Offer Bi-Directional Charging Capability By 2025 | The announcement was made at the Investor Day event, but Elon Musk said he didn't expect widespread use of the feature by owners.",18,11h167y,teslainvestorsclub,https://insideevs.com/news/655334/tesla-lineup-get-bi-directional-charging-capability-by-2025/,31,,1677851187.0
52,"Site of Tesla Mexico factory near double size of Texas plant, local official says",156,11gnkn3,teslainvestorsclub,https://www.reuters.com/business/autos-transportation/site-tesla-mexico-factory-near-double-size-texas-plant-local-official-says-2023-03-03/,43,,1677807647.0
53,"Tesla exec told Dave Lee that Giga Monterrey is for making cars for Latin America, not the U.S.",190,11gajfa,teslainvestorsclub,https://i.redd.it/4frza5g2gdla1.jpg,40,,1677783070.0
54,"Daily Thread - March 03, 2023",15,11gv2l0,teslainvestorsclub,https://www.reddit.com/r/teslainvestorsclub/comments/11gv2l0/daily_thread_march_03_2023/,108,"All topics are permitted in this thread. If you are new here (or even if you're not), please skim through our [Rules and Disclaimer](https://www.reddit.com/r/teslainvestorsclub/wiki/index) page to gain a better understanding of expectations in our community.

See our [Long-running Thread](https://www.reddit.com/r/teslainvestorsclub/search?q=flair_name%3A%22📜%22&restrict_sr=1) for more in-depth discussions.

https://preview.redd.it/lhv8txqvuu191.png?width=250&format=png&auto=webp&v=enabled&s=267eb357a6754fd918a6c316004c470715caefc5",1677830470.0
55,"Lars Moravy Explains The ""Unboxed"" Gen-3 Assembly Process",146,11ga505,teslainvestorsclub,https://v.redd.it/mmzum0eqddla1,54,,1677782089.0
56,Giga Austin: Tesla Leading the 'Race to the Bottom' on EV,163,11g548i,teslainvestorsclub,https://i.redd.it/09r2igitdcla1.png,50,,1677769919.0
57,"Colin Campbell announced 75% reduction in Silicon Carbide, contributing to ~$1k reduction in the Gen-3 Drive Unit cost",56,11gbl17,teslainvestorsclub,https://v.redd.it/cwf5weyundla1,4,,1677785508.0
58,"Tesla is ‘setting the standard’ for the EV industry, says ARK’s Chief Futurist Brett Winston - Yahoo Finance",41,11gdjcd,teslainvestorsclub,https://www.youtube.com/watch?v=1hNPmBCsb-g,6,,1677790031.0
59,Daily kWh per post,28,11gdbnc,teslainvestorsclub,https://i.redd.it/jx3enbxfrdla1.png,14,,1677789531.0
60,Tesla Investor Day in 28 Min (Supercut) (2023),60,11g2nqj,teslainvestorsclub,https://youtu.be/eIQ20RvhUhg,11,,1677763350.0
61,Munro Live Q&A Panel post-investor day,38,11fzsaa,teslainvestorsclub,https://www.youtube.com/live/1Nd365hMdoc,12,,1677754085.0
62,Next Gen Permanent Magnet Motor will Contain Zero Rare Earth Elements,220,11fn5u9,teslainvestorsclub,https://i.redd.it/sx9fo3tjy7la1.jpg,36,,1677716541.0
63,Alphabet’s Robotaxi Unit Waymo Says it Laid Off 8%,17,11g3rt3,teslainvestorsclub,https://www.theinformation.com/articles/alphabets-robotaxi-unit-waymo-says-it-laid-off-8,4,,1677766379.0
64,Cybertruck and all future products will use 48v low-voltage architecture,155,11foi65,teslainvestorsclub,https://i.redd.it/uj82xrr788la1.jpg,66,,1677719939.0
65,"Our next Gigafactory will be in Mexico, manufacturing our next-gen vehicle",142,11fn6ki,teslainvestorsclub,https://twitter.com/Tesla/status/1631087437723172868,65,,1677716593.0
66,"Daily Thread - March 02, 2023",30,11fwzjy,teslainvestorsclub,https://www.reddit.com/r/teslainvestorsclub/comments/11fwzjy/daily_thread_march_02_2023/,505,"All topics are permitted in this thread. If you are new here (or even if you're not), please skim through our [Rules and Disclaimer](https://www.reddit.com/r/teslainvestorsclub/wiki/index) page to gain a better understanding of expectations in our community.

See our [Long-running Thread](https://www.reddit.com/r/teslainvestorsclub/search?q=flair_name%3A%22📜%22&restrict_sr=1) for more in-depth discussions.

https://preview.redd.it/lhv8txqvuu191.png?width=250&format=png&auto=webp&v=enabled&s=267eb357a6754fd918a6c316004c470715caefc5",1677744050.0
67,Unlimited overnight home charging for $30/month - Coming in July to Texas,103,11fn03y,teslainvestorsclub,https://i.redd.it/a69mvf7px7la1.jpg,17,,1677716148.0
68,[Live Stream] 2023 Investor Day,105,11fhw2c,teslainvestorsclub,https://www.youtube.com/watch?v=Hl1zEzVUV7w,489,,1677704386.0
69,Fatal Tesla Model Y crash investigation finds accelerator engaged in viral video,271,11f5q3v,teslainvestorsclub,https://www.teslarati.com/fatal-tesla-model-y-crash-investigation-accelerator-pressed-viral-video/amp/,113,,1677682333.0
70,All You Need to Know - Tesla Investor Day Recap,26,11fqqfg,teslainvestorsclub,https://www.youtube.com/live/SYNow13yjTA?feature=share,53,,1677725544.0
71,The massive recalled Hummer EV battery being dropped out..,20,11fs8ma,teslainvestorsclub,https://www.reddit.com/r/Justrolledintotheshop/comments/11flrpm/_/,9,,1677729554.0
72,"4K Walk-around of Cybertruck, compliments of Rob Maurer",119,11fbgqn,teslainvestorsclub,https://youtu.be/BuW8BYKv688,57,,1677695755.0
73,Cathie Wood Says Half-Price Robotaxis Will Steal The Show At Tesla's Investor Day: Why The Event Could Prove That Competitors Are Doomed,30,11f6b4o,teslainvestorsclub,https://www.benzinga.com/trading-ideas/long-ideas/23/02/31098119/cathie-wood-says-half-price-robotaxis-will-steal-the-show-at-teslas-investor-day-why-the,46,,1677683748.0
74,Tesla has been approved to import BEVs to Malaysia!,130,11ew7kk,teslainvestorsclub,https://twitter.com/tzafrul_aziz/status/1630761153503842305?t=zojjKpY5B9oG1o6P9MWW0A&s=19,11,,1677651345.0
75,Exclusive: Tesla readies revamp of Model Y codenamed 'Juniper',58,11ez9yh,teslainvestorsclub,https://www.reuters.com/business/autos-transportation/tesla-readies-revamp-model-y-codenamed-juniper-sources-2023-03-01/,28,,1677662472.0
76,"Daily Thread - March 01, 2023",44,11ey0xf,teslainvestorsclub,https://www.reddit.com/r/teslainvestorsclub/comments/11ey0xf/daily_thread_march_01_2023/,528,"All topics are permitted in this thread. If you are new here (or even if you're not), please skim through our [Rules and Disclaimer](https://www.reddit.com/r/teslainvestorsclub/wiki/index) page to gain a better understanding of expectations in our community.

See our [Long-running Thread](https://www.reddit.com/r/teslainvestorsclub/search?q=flair_name%3A%22📜%22&restrict_sr=1) for more in-depth discussions.

https://preview.redd.it/lhv8txqvuu191.png?width=250&format=png&auto=webp&v=enabled&s=267eb357a6754fd918a6c316004c470715caefc5",1677657683.0
77,Tesla's Carbon Trading Strategy,9,11f6mi1,teslainvestorsclub,https://carbontrading.substack.com/p/teslas-carbon-trading-strategy,8,,1677684492.0
78,Select Superchargers in the US are now open to other EVs →,89,11eo8he,teslainvestorsclub,https://twitter.com/TeslaCharging/status/1630710960909619201,38,,1677628658.0
79,"Rivian posts mixed fourth quarter and underwhelming EV production outlook, stock falls",122,11el8vn,teslainvestorsclub,https://www.cnbc.com/2023/02/28/rivian-rivn-earnings-q4-2022.html,97,,1677621431.0
80,Supercharger membership packages for Non-Tesla EV owners,51,11ept7z,teslainvestorsclub,https://twitter.com/SawyerMerritt/status/1630724303976030210,20,,1677632726.0
81,China Insurance Registrations for the Week Ended February 26,5,11f0j1i,teslainvestorsclub,https://cnevpost.com/2023/02/28/china-nev-insurance-registrations-for-week-ending-feb-26/,6,,1677667157.0
82,"New Toyota CEO, with eye on Tesla, plots next-gen EV platform push",71,11ee0o1,teslainvestorsclub,https://www.autonews.com/manufacturing/how-toyotas-new-ceo-koji-sato-plans-get-real-about-evs,44,,1677604278.0
83,"Tesla and Mexico to announce a deal for a factory, says official",117,11e5csz,teslainvestorsclub,https://electrek.co/2023/02/28/tesla-mexico-deal-factory/,40,,1677588873.0
84,Feb. China Insurance estimate: 32k — second best quarter ever in China — +39% YoY growth,56,11e5kka,teslainvestorsclub,https://twitter.com/piloly/status/1630467993275625472,31,,1677589493.0
